{
  "status": "completed",
  "summary": "Set 124 Session 2 left exactly one mechanism for the machine/project fact. Session 1 re-scoped project-verify-type.txt to gitignored machine/project state; that made ai_router/local-overrides.yaml -- per-machine and living inside the checkout -- occupy the identical scope, so both files answered 'what verifies this project, on THIS machine' and only one could be authoritative. transport.profile is retired as a local override: no transport.* key is locally overridable now, and a stale key is REFUSED at config load with a message naming `python -m ai_router.verify_type --set <VALUE>`, where <VALUE> is DERIVED from the stale profile via VERIFY_TYPE_BY_PROFILE rather than left as a placeholder. Refuse-vs-warn was decided under prefer-reversible and journaled to decisions.jsonl: on a Copilot seat with no project file, warn-and-ignore would silently fall the profile back to `api` and then fail validate_provider_api_keys on a seat that has no keys by design -- a confusing credential error a long way from its cause, where a refusal naming one command is reversible in seconds. Both tests that pinned the retired precedence were REPLACED rather than deleted, and the claim was propagated to router-config.yaml (two comment blocks) and verify_type.py's derivation docstring. Migration dogfooded on this seat, which carried the key: the refusal fired naming COPILOT_CLI correctly, and after deleting the block load_config still resolves copilot-cli from the project file with copilot_preflight green. Full pytest: 3991 passed, 9 skipped.",
  "verification_method": "api",
  "verification_verdict": "VERIFIED",
  "verification_message_ids": [],
  "files_changed": [
    "ai_router/config.py",
    "ai_router/router-config.yaml",
    "ai_router/verify_type.py",
    "ai_router/tests/test_verify_type_resolution.py",
    "ai_router/tests/test_local_overrides_merge.py",
    "ai_router/tests/test_routing_exclusion_integrity.py",
    "docs/session-sets/124-verify-type-is-machine-project-state/s2-conventions.md",
    "docs/planning/work-explorer-in-progress-step-icon.md"
  ],
  "lessons_cited": [
    "L-112-1",
    "L-069-1",
    "L-064-8"
  ],
  "next_orchestrator": {
    "engine": "github-copilot",
    "provider": "anthropic",
    "model": "claude-opus-5",
    "effort": "high",
    "reason": {
      "code": "continue-current-trajectory",
      "specifics": "Session 3 propagates the machine/project claim to every remaining echo -- README, quick-start, the three engine bootstrap files, verify-type-resolution.md, adopt-dabbler.md, the consumer-bootstrap template, and copilotSeatSetup.ts plus the two suite tests pinning its strings -- then walks a true cold start, which is now the normal first run on every machine. It needs the live context of what Sessions 1 and 2 actually shipped, because the doc edits must describe the delivered behaviour rather than the design intent, and it owes the full Playwright suite at close because it edits extension source."
    }
  },
  "blockers": []
}
