{
  "status": "completed",
  "summary": "Set 116 Session 3 of 3, \"Ten gates to three\" -- the set-terminal session. THE RULING, IMPLEMENTED AND ATTESTED: the operator's 2026-08-10 gate ruling was presented as an education-mode brief and re-attested at the moment of implementation (decisions.jsonl, authority=human, rubric_line=verification-reduction), because reducing verification sits inside the decision-rights hard carve-out and decision_journal refuses to write it under AI authority. Ten close-out checks are now THREE gates (verification_integrity, uat_walk_recorded, test_run_fresh), TWO transactional preconditions (working_tree_clean, pushed_to_remote -- they protect the WRITE, not the ceremony), and FIVE advisory checks that run, print, and cannot refuse (activity_log_entry, next_orchestrator_present, change_log_fresh, checklist_posted, verification_method_vocabulary). NOTHING WAS DELETED: every demoted check keeps its predicate, message and tests, and a test asserts that. gate_checks.ADVISORY_CHECKS is the executable form of the table and is_blocking_check() the single predicate every consumer asks; GateResult carries a `blocking` field so gate_results says which kind each row was, and [WARN] replaces [FAIL] on a demoted failure. GATE (c) REPAIRED: pytest and mocha carried expensive=False -- and `expensive` is the flag deciding whether test_run_fresh has an OPINION, not a claim about the clock -- so the once-per-session rule never governed the suite that cost the time (Set 112 S3: 15 runs, 186 minutes, unremarked). All three layers are now expensive, and the full run moved from Step 5 to Step 8, after remediation, because Step 7 remediation IS a code change and the old instruction was unsatisfiable rather than merely ignored. TWO DEFECTS THE TESTS CAUGHT THAT READING DID NOT. (1) Removing the close backstop's vocabulary early-out was wrong: the ruling falsified the REASON that skip gave, not its conclusion, since an unknown verification_method still has no corroboration path -- restored with corrected reasoning. (2) Demoting change_log_fresh turned a clean refusal into a CRASH: _flip_state_to_closed required change-log.md to be PRESENT before calling a session the last one, a mirror unreachable while the gate refused first; once the gate warned, a final session without one wrote status:in-progress over an all-complete sessions[] and raised SessionStateInvariantError. The redundant condition is removed and the regression asserts the resulting STATE, not merely that the close succeeded. The generalisation is L-069-1 read backwards: demoting a gate is not a local change -- find every sibling of the GUARANTEE you are removing, because while the gate blocked, those siblings were unreachable and therefore untested. VERIFICATION: round 1 (discovery, 2-lens fan-out, gpt-5-6-sol both lenses, anthropic excluded, $0.786) returned VERIFIED from BOTH lenses with zero Critical/Major. Five nits; all five fixed, because three were documents written this session that stated something false about the code beside them. Both lenses converged independently on two: \"a docs-only session owes nothing\" is FALSE under ai_router/ (covers is a path PREFIX, not a file type -- narrowing it to exempt docs folders was considered and REJECTED because it would make the gate skippable by putting code in a docs-named folder; both sides of the boundary are now pinned by tests), and --force was never inside \"every close\" (it runs verification_integrity alone; correct and older than this ruling, so documented rather than changed). Per-nit record: s3-nit-dispositions.md. SET-TERMINAL DELIVERABLES: change-log.md, the REQUIRED path-aware critique, and the Step 9 review. Suites of record taken after the last code change, per the ordering this very session ships: pytest 3850 passed / 5 skipped (301.05s) and Playwright 36 passed (12.1m, owed because close_session.py and session_state.py are both on its covers list). OPERATOR CONSTRAINT recorded mid-session: parallelism capped at 8 pending Set 117's fix for an OS-resource bug; every run here used -n 8, while pytest.ini still declares -n auto. That disagreement is a named residual for Set 117, which is already authored. ROUNDS 2-4 (post-critique): the close backstop refused the close with a real Major -- the round-1 nit fix had relabelled a mid-loop full suite as 'targeted testing with a wide net', which preserves the exact behaviour this set exists to remove, and its evidence was this session's own THREE full pytest runs. Accepted in full: the relabel is gone, Step 5 now says do not run a full suite 'not even just to see', and the path-aware critique is named as a CODE-CHANGING stage that must precede the single full run (the half I had missed, and the direct cause of the second recorded run). Round 3 then caught a defect I introduced 20 minutes earlier while trimming for the 4,000-token ceiling: deleting Step 9's pointer left NOTHING telling an orchestrator to RUN the critique. Fixed in one sentence; round 4 (remediation-review) returned VERIFIED with 2 fix-verdicts accepted, 0 rejected, $0.0651. NO SUITE WAS RE-RUN for any of it: every edit was under docs/, which is outside every suite's covers, proven by run_of_record check --check exiting 0 with both runs still fresh. COST OF THIS SESSION'S VERIFICATION: 13 routed calls, $4.75. The code was clean at round 1 and stayed clean; every Major after it concerned the PROSE of a token-capped preload document, and two of the three were introduced by fixing the previous one. That is the strongest evidence this set produced about what to cut next, and it is recorded as a named residual rather than acted on here.",
  "verification_method": "api",
  "verification_verdict": "VERIFIED",
  "verification_message_ids": [],
  "next_orchestrator": null,
  "blockers": [],
  "files_changed": [
    "ai_router/gate_checks.py",
    "ai_router/close_session.py",
    "ai_router/session_state.py",
    "ai_router/close_backstop.py",
    "ai_router/run_of_record.py",
    "ai_router/CHANGELOG.md",
    "ai_router/docs/close-out.md",
    "ai_router/tests/test_gate_checks.py",
    "ai_router/tests/test_close_session_skeleton.py",
    "ai_router/tests/test_close_session_integration.py",
    "ai_router/tests/test_close_backstop.py",
    "ai_router/tests/test_verification_integrity_gate.py",
    "ai_router/tests/test_run_of_record.py",
    "ai_router/tests/test_checklist_posts.py",
    "docs/session-constitution.md",
    "docs/planning/session-set-authoring-guide.md",
    "docs/repository-reference.md",
    "docs/planning/lessons-learned.md",
    "tools/dabbler-ai-orchestration/dist/extension.js",
    "tools/dabbler-ai-orchestration/dist/extension.js.map",
    "docs/session-sets/116-session-latency-and-verification-integrity/change-log.md",
    "docs/session-sets/116-session-latency-and-verification-integrity/s3-conventions.md",
    "docs/session-sets/116-session-latency-and-verification-integrity/s3-nit-dispositions.md",
    "docs/session-sets/116-session-latency-and-verification-integrity/ai-assignment.md",
    "docs/session-sets/116-session-latency-and-verification-integrity/decisions.jsonl",
    "docs/session-sets/116-session-latency-and-verification-integrity/activity-log.json",
    "docs/session-sets/116-session-latency-and-verification-integrity/test-runs.jsonl",
    "docs/session-sets/116-session-latency-and-verification-integrity/checklist-posts.jsonl",
    "docs/session-sets/116-session-latency-and-verification-integrity/disposition.json",
    "docs/session-sets/116-session-latency-and-verification-integrity/path-aware-critique.json"
  ],
  "lessons_cited": [
    "L-069-1",
    "L-064-8",
    "L-112-1"
  ]
}