{
  "status": "completed",
  "summary": "Session 1 shipped ai_router/verify_type.py: the operator's three-branch rule as one entry point (project-verify-type.txt at the project root, else the machine default confirmed once and written there, else guided setup in the terminal), and made config.load_config DERIVE transport.profile from it instead of defaulting it independently. Where a project has committed an answer, that answer IS the profile -- over the tracked config and over a seat-local local-overrides.yaml both -- so the two facts cannot disagree; the api default survives as the last step of resolution rather than as a parallel answer beside it. An unconfirmed environment default never silently re-routes dispatch, and a resolution names a transport profile only when the project has committed one. Five verification rounds settled the precedence rule: the first anchor that lands in a project answers outright, the loaded config's project before the caller's, and a project that has committed nothing is answered by its own configured profile rather than by another project's file. 16 falsifiers (both directions, look-alikes, and a structural bijection against config's profile vocabulary); full pytest 3952 passed / 9 skipped.",
  "verification_method": "api",
  "verification_verdict": "VERIFIED",
  "files_changed": [
    "ai_router/verify_type.py",
    "ai_router/config.py",
    "ai_router/__init__.py",
    "ai_router/router-config.yaml",
    "ai_router/tests/test_verify_type_resolution.py",
    "docs/planning/verify-type-resolution.md",
    "docs/session-sets/123-verify-type-and-startup-simplification/spec.md",
    "docs/session-sets/123-verify-type-and-startup-simplification/ai-assignment.md",
    "docs/session-sets/123-verify-type-and-startup-simplification/s1-remediation-round-1.md",
    "docs/session-sets/123-verify-type-and-startup-simplification/s1-remediation-round-2.md",
    "docs/session-sets/123-verify-type-and-startup-simplification/s1-remediation-round-3.md",
    "docs/session-sets/123-verify-type-and-startup-simplification/s1-remediation-round-4.md"
  ],
  "verification_message_ids": [],
  "next_orchestrator": {
    "engine": "github-copilot",
    "provider": "anthropic",
    "model": "claude-opus-5",
    "effort": "high",
    "reason": {
      "code": "continue-current-trajectory",
      "specifics": "Session 2 (the qualified verdict) reasons about the precondition this session just defined -- that a resolution names a transport profile only when the project has committed one -- and touches verification*.py / session_state.py with that guarantee in hand. Same surface, live context, no blocker and no capability gap; the verifier stays cross-provider by registry exclusion regardless."
    }
  },
  "blockers": [],
  "lessons_cited": [
    "L-112-1",
    "L-069-1",
    "L-064-8"
  ]
}
